{
  "schema_version": "jepa_adapter_signals/v1",
  "experiment_type": "baseline_explicit_cost",
  "run_id": "2026-02-13T060000Z_baseline-explicit-cost_seed0",
  "adapter": {
    "name": "ree_jepa_adapter",
    "version": "v1+0.1.0"
  },
  "stream_presence": {
    "z_t": true,
    "z_hat": true,
    "pe_latent": true,
    "uncertainty_latent": false,
    "trace_context_mask_ids": true,
    "trace_action_token": false
  },
  "pe_latent_fields": [
    "mean",
    "p95"
  ],
  "uncertainty_estimator": "none",
  "signal_metrics": {
    "latent_prediction_error_mean": 0.0032,
    "latent_prediction_error_p95": 0.0032,
    "latent_residual_coverage_rate": 0.0,
    "precision_input_completeness_rate": 1.0
  },
  "notes": "No committed latent prediction-error samples were observed; deterministic fallback derived from total_harm and final_residue."
}
